{
  "kind": "meeting",
  "school": {
    "code": "jhu"
  },
  "course": {
    "code": "EN.600.418"
  },
  "section": {
    "code": "01"
  },
  "days": ["M", "W", "F"],
  "time": {
    "start": "13:30",
    "end": "14:45"
  },
  "location": {
    "campus": "Homewood Campus",
    "building": "Shaffer Hall",
    "room": "301"
  }
}